[
  {
    "audit_id": "AUDIT_LOG_001",
    "nomination_id": "NOM_001_RECORD_OF__0000",
    "auditing_firm_id": "Deloitte & Touche LLP",
    "lead_auditor_name": "Senior Partner 1",
    "audit_timestamp": "1959-12-15T12:00:00Z",
    "digital_signature_hash": "38c907868e69959c4d8d3e7606cce95bfc40bce66488863c78971afd2a074459",
    "tabulation_vault_partition": "VAULT_PARTITION_SECURE_0",
    "discrepancy_check_passed": true,
    "recount_required_flag": false,
    "compliance_certificate_code": "CERT_TAB_7000"
  },
  {
    "audit_id": "AUDIT_LOG_002",
    "nomination_id": "NOM_001_ALBUM_OF_T_0001",
    "auditing_firm_id": "Deloitte & Touche LLP",
    "lead_auditor_name": "Senior Partner 2",
    "audit_timestamp": "1960-12-15T12:00:00Z",
    "digital_signature_hash": "440aabb74aa931153aefa395ee4b1319096dd011ce32e90960dea3e78d206605",
    "tabulation_vault_partition": "VAULT_PARTITION_SECURE_1",
    "discrepancy_check_passed": true,
    "recount_required_flag": false,
    "compliance_certificate_code": "CERT_TAB_7001"
  },
  {
    "audit_id": "AUDIT_LOG_003",
    "nomination_id": "NOM_001_SONG_OF_TH_0002",
    "auditing_firm_id": "Deloitte & Touche LLP",
    "lead_auditor_name": "Senior Partner 3",
    "audit_timestamp": "1961-12-15T12:00:00Z",
    "digital_signature_hash": "ea6d98b88e6526daf642e036db01926046aa94d9284f756b1c7082442341896a",
    "tabulation_vault_partition": "VAULT_PARTITION_SECURE_2",
    "discrepancy_check_passed": true,
    "recount_required_flag": false,
    "compliance_certificate_code": "CERT_TAB_7002"
  },
  {
    "audit_id": "AUDIT_LOG_004",
    "nomination_id": "NOM_001_BEST_VOCAL_0003",
    "auditing_firm_id": "Deloitte & Touche LLP",
    "lead_auditor_name": "Senior Partner 4",
    "audit_timestamp": "1962-12-15T12:00:00Z",
    "digital_signature_hash": "e4de384246350f8923e71e8e4794c747dfacaef12f3ed6d2c3063f569be25177",
    "tabulation_vault_partition": "VAULT_PARTITION_SECURE_3",
    "discrepancy_check_passed": true,
    "recount_required_flag": false,
    "compliance_certificate_code": "CERT_TAB_7003"
  },
  {
    "audit_id": "AUDIT_LOG_005",
    "nomination_id": "NOM_001_BEST_VOCAL_0004",
    "auditing_firm_id": "Deloitte & Touche LLP",
    "lead_auditor_name": "Senior Partner 5",
    "audit_timestamp": "1963-12-15T12:00:00Z",
    "digital_signature_hash": "81add38a2ad7c982c6266897a10928f3854e4f9e2afd9ed3add7b133f15c73ad",
    "tabulation_vault_partition": "VAULT_PARTITION_SECURE_0",
    "discrepancy_check_passed": true,
    "recount_required_flag": false,
    "compliance_certificate_code": "CERT_TAB_7004"
  },
  {
    "audit_id": "AUDIT_LOG_006",
    "nomination_id": "NOM_001_BEST_PERFO_0005",
    "auditing_firm_id": "Deloitte & Touche LLP",
    "lead_auditor_name": "Senior Partner 6",
    "audit_timestamp": "1964-12-15T12:00:00Z",
    "digital_signature_hash": "39bd43afc7a0a9b6fb98cd6d656af5a36098fadd1cb2499c9652620754d3efd7",
    "tabulation_vault_partition": "VAULT_PARTITION_SECURE_1",
    "discrepancy_check_passed": true,
    "recount_required_flag": false,
    "compliance_certificate_code": "CERT_TAB_7005"
  },
  {
    "audit_id": "AUDIT_LOG_007",
    "nomination_id": "NOM_001_BEST_PERFO_0006",
    "auditing_firm_id": "Deloitte & Touche LLP",
    "lead_auditor_name": "Senior Partner 7",
    "audit_timestamp": "1965-12-15T12:00:00Z",
    "digital_signature_hash": "56079ec82fd33ae46e0965f70842d4d47d666840b15b1ed39d1f09cb26963d43",
    "tabulation_vault_partition": "VAULT_PARTITION_SECURE_2",
    "discrepancy_check_passed": true,
    "recount_required_flag": false,
    "compliance_certificate_code": "CERT_TAB_7006"
  },
  {
    "audit_id": "AUDIT_LOG_008",
    "nomination_id": "NOM_001_BEST_PERFO_0007",
    "auditing_firm_id": "Deloitte & Touche LLP",
    "lead_auditor_name": "Senior Partner 8",
    "audit_timestamp": "1966-12-15T12:00:00Z",
    "digital_signature_hash": "d4cd05bbd62056e25dffc6dba9d17a4d2409cd1356da094b2a388ddb0dd1aed8",
    "tabulation_vault_partition": "VAULT_PARTITION_SECURE_3",
    "discrepancy_check_passed": true,
    "recount_required_flag": false,
    "compliance_certificate_code": "CERT_TAB_7007"
  },
  {
    "audit_id": "AUDIT_LOG_009",
    "nomination_id": "NOM_001_BEST_JAZZ__0008",
    "auditing_firm_id": "Deloitte & Touche LLP",
    "lead_auditor_name": "Senior Partner 9",
    "audit_timestamp": "1967-12-15T12:00:00Z",
    "digital_signature_hash": "13d16577dc00eda3529289dee596df28f55a8906e967d0a2f63fb02bd6ccdbeb",
    "tabulation_vault_partition": "VAULT_PARTITION_SECURE_0",
    "discrepancy_check_passed": true,
    "recount_required_flag": false,
    "compliance_certificate_code": "CERT_TAB_7008"
  },
  {
    "audit_id": "AUDIT_LOG_010",
    "nomination_id": "NOM_001_BEST_JAZZ__0009",
    "auditing_firm_id": "Deloitte & Touche LLP",
    "lead_auditor_name": "Senior Partner 10",
    "audit_timestamp": "1968-12-15T12:00:00Z",
    "digital_signature_hash": "a424732282902b2fcab275d03370a868ac096d6c96f3d263730f20ccb2a63ed5",
    "tabulation_vault_partition": "VAULT_PARTITION_SECURE_1",
    "discrepancy_check_passed": true,
    "recount_required_flag": false,
    "compliance_certificate_code": "CERT_TAB_7009"
  },
  {
    "audit_id": "AUDIT_LOG_011",
    "nomination_id": "NOM_001_BEST_COMED_0010",
    "auditing_firm_id": "Deloitte & Touche LLP",
    "lead_auditor_name": "Senior Partner 11",
    "audit_timestamp": "1969-12-15T12:00:00Z",
    "digital_signature_hash": "b5ea1b960ccacccad6e0e0f0a2a75c46dddee2ae5f2159af8c1b6f1d2929b7c0",
    "tabulation_vault_partition": "VAULT_PARTITION_SECURE_2",
    "discrepancy_check_passed": true,
    "recount_required_flag": false,
    "compliance_certificate_code": "CERT_TAB_7010"
  },
  {
    "audit_id": "AUDIT_LOG_012",
    "nomination_id": "NOM_001_BEST_COUNT_0011",
    "auditing_firm_id": "Deloitte & Touche LLP",
    "lead_auditor_name": "Senior Partner 12",
    "audit_timestamp": "1970-12-15T12:00:00Z",
    "digital_signature_hash": "0edec2ef1a0214ad27e5fe2193c9d94bf2a76d0216d7feadb820f307217a5532",
    "tabulation_vault_partition": "VAULT_PARTITION_SECURE_3",
    "discrepancy_check_passed": true,
    "recount_required_flag": false,
    "compliance_certificate_code": "CERT_TAB_7011"
  },
  {
    "audit_id": "AUDIT_LOG_013",
    "nomination_id": "NOM_001_BEST_RHYTH_0012",
    "auditing_firm_id": "Deloitte & Touche LLP",
    "lead_auditor_name": "Senior Partner 13",
    "audit_timestamp": "1971-12-15T12:00:00Z",
    "digital_signature_hash": "2dafc7c727af5f478bdab7841fb1c4e3c0f5e603bd3676c60b8a974fe1a31c27",
    "tabulation_vault_partition": "VAULT_PARTITION_SECURE_0",
    "discrepancy_check_passed": true,
    "recount_required_flag": false,
    "compliance_certificate_code": "CERT_TAB_7012"
  },
  {
    "audit_id": "AUDIT_LOG_014",
    "nomination_id": "NOM_001_BEST_ARRAN_0013",
    "auditing_firm_id": "Deloitte & Touche LLP",
    "lead_auditor_name": "Senior Partner 14",
    "audit_timestamp": "1972-12-15T12:00:00Z",
    "digital_signature_hash": "af02b1767b5318f93447feb4ee35d3ee5351b005c838ca35b0440306d630aa66",
    "tabulation_vault_partition": "VAULT_PARTITION_SECURE_1",
    "discrepancy_check_passed": true,
    "recount_required_flag": false,
    "compliance_certificate_code": "CERT_TAB_7013"
  },
  {
    "audit_id": "AUDIT_LOG_015",
    "nomination_id": "NOM_001_BEST_ENGIN_0014",
    "auditing_firm_id": "Deloitte & Touche LLP",
    "lead_auditor_name": "Senior Partner 15",
    "audit_timestamp": "1973-12-15T12:00:00Z",
    "digital_signature_hash": "a796eb50fdec54ae62ee980e64a849301275cda4ae62b84701fd863192a2fc45",
    "tabulation_vault_partition": "VAULT_PARTITION_SECURE_2",
    "discrepancy_check_passed": true,
    "recount_required_flag": false,
    "compliance_certificate_code": "CERT_TAB_7014"
  },
  {
    "audit_id": "AUDIT_LOG_016",
    "nomination_id": "NOM_001_BEST_ENGIN_0015",
    "auditing_firm_id": "Deloitte & Touche LLP",
    "lead_auditor_name": "Senior Partner 16",
    "audit_timestamp": "1974-12-15T12:00:00Z",
    "digital_signature_hash": "d868bbeed427f0f10795c694f3d41183812d98646904d1d318fb1808d8f73854",
    "tabulation_vault_partition": "VAULT_PARTITION_SECURE_3",
    "discrepancy_check_passed": true,
    "recount_required_flag": false,
    "compliance_certificate_code": "CERT_TAB_7015"
  },
  {
    "audit_id": "AUDIT_LOG_017",
    "nomination_id": "NOM_001_BEST_ALBUM_0016",
    "auditing_firm_id": "Deloitte & Touche LLP",
    "lead_auditor_name": "Senior Partner 17",
    "audit_timestamp": "1975-12-15T12:00:00Z",
    "digital_signature_hash": "4294d72bb0eaf73ae161bd6bfefd6ae44deb395933161a743623760550b6070d",
    "tabulation_vault_partition": "VAULT_PARTITION_SECURE_0",
    "discrepancy_check_passed": true,
    "recount_required_flag": false,
    "compliance_certificate_code": "CERT_TAB_7016"
  },
  {
    "audit_id": "AUDIT_LOG_018",
    "nomination_id": "NOM_001_BEST_MUSIC_0017",
    "auditing_firm_id": "Deloitte & Touche LLP",
    "lead_auditor_name": "Senior Partner 18",
    "audit_timestamp": "1976-12-15T12:00:00Z",
    "digital_signature_hash": "103e663d663141e74c4cc59b07915a48f6ef2262c3c7130e2a0731f300accbf8",
    "tabulation_vault_partition": "VAULT_PARTITION_SECURE_1",
    "discrepancy_check_passed": true,
    "recount_required_flag": false,
    "compliance_certificate_code": "CERT_TAB_7017"
  },
  {
    "audit_id": "AUDIT_LOG_019",
    "nomination_id": "NOM_001_BEST_ORIGI_0018",
    "auditing_firm_id": "Deloitte & Touche LLP",
    "lead_auditor_name": "Senior Partner 19",
    "audit_timestamp": "1977-12-15T12:00:00Z",
    "digital_signature_hash": "97a7f5340b32abd0bb8b29ffe02f4eebbd7269e56c5c5d716035101e8b033b28",
    "tabulation_vault_partition": "VAULT_PARTITION_SECURE_2",
    "discrepancy_check_passed": true,
    "recount_required_flag": false,
    "compliance_certificate_code": "CERT_TAB_7018"
  },
  {
    "audit_id": "AUDIT_LOG_020",
    "nomination_id": "NOM_001_BEST_SOUND_0019",
    "auditing_firm_id": "Deloitte & Touche LLP",
    "lead_auditor_name": "Senior Partner 20",